{
  "variant_version_id": "version-a-v1",
  "eval_set_version_id": "evalset-v1",
  "strategy_ref": "external-script-v1",
  "run_config_hash": "external-script-config-v1",
  "results": {
    "casever-null-v1": true,
    "casever-auth-v1": true,
    "casever-noise-v1": false
  },
  "metadata": {
    "runner": "fixture",
    "notes": "Fixture for the seed code-reviewer eval set. Real callers should fetch EvalSetVersion first and use its case_version_refs."
  }
}
